{
  "$schema": "https://json-schema.org/draft/2020-12/schema",
  "$id": "https://example.com/design-system.schema.json",
  "title": "DesignSystem",
  "type": "object",
  "required": ["schemaVersion", "version", "lastUpdated", "tokens", "components", "changelog"],
  "properties": {
    "schemaVersion": { "const": "1" },
    "version": { "type": "string", "pattern": "^\\d+\\.\\d+\\.\\d+$" },
    "lastUpdated": { "type": "string", "pattern": "^\\d{4}-\\d{2}-\\d{2}T\\d{2}:\\d{2}:\\d{2}Z$" },
    "tokens": {
      "type": "object",
      "required": ["primitive", "semantic"],
      "properties": {
        "primitive": {
          "type": "object",
          "required": ["color", "type", "space"],
          "properties": {
            "color": { "type": "object", "minProperties": 2, "additionalProperties": { "type": "string" } },
            "type":  { "type": "object", "minProperties": 2, "additionalProperties": { "type": "string" } },
            "space": { "type": "object", "minProperties": 2, "additionalProperties": { "type": "string" } },
            "radius":{ "type": "object", "additionalProperties": { "type": "string" } },
            "shadow":{ "type": "object", "additionalProperties": { "type": "string" } },
            "motion":{ "type": "object", "additionalProperties": { "type": "string" } }
          }
        },
        "semantic": {
          "type": "object",
          "minProperties": 4,
          "additionalProperties": { "type": "string" }
        }
      }
    },
    "components": {
      "type": "object",
      "additionalProperties": {
        "type": "object",
        "required": ["role", "job", "states"],
        "properties": {
          "role": { "enum": ["primitive", "pattern", "template"] },
          "job": { "type": "string", "minLength": 10 },
          "variants": { "type": "object" },
          "states": {
            "type": "array",
            "minItems": 1,
            "items": { "type": "string" }
          }
        },
        "additionalProperties": true
      }
    },
    "changelog": {
      "type": "array",
      "minItems": 1,
      "items": {
        "type": "object",
        "required": ["version", "at", "change", "reason"],
        "properties": {
          "version": { "type": "string", "pattern": "^\\d+\\.\\d+\\.\\d+$" },
          "at": { "type": "string", "pattern": "^\\d{4}-\\d{2}-\\d{2}T\\d{2}:\\d{2}:\\d{2}Z$" },
          "change": { "type": "string" },
          "reason": { "type": "string", "minLength": 5 }
        }
      }
    }
  },
  "additionalProperties": false
}
